"ORIGINAL"	"DBFIELD"	"TYPE"
"Empleados (cantidad) (Requisitos de Participación)"	"Requisitos_de_Participacion/Empleados/cantidad"	"string"
"Empleados (descripción) (Requisitos de Participación)"	"Requisitos_de_Participacion/Empleados/descripcion"	"string"
"Experiencia (cantidad) (Requisitos de Participación)"	"Requisitos_de_Participacion/Experiencia/cantidad"	"string"
"Experiencia (descripción) (Requisitos de Participación)"	"Requisitos_de_Participacion/Experiencia/descripcion"	"string"
"Identificador de país (Adjudicatario)"	"Adjudicatario/Identificador_de_pais"	"string"
"Medio de presentación de ofertas electrónicas (Proceso de licitación)"	"Proceso_de_licitacion/Medio_de_presentacion_de_ofertas_electronicas"	"string"
"Nombre de la condición (Condiciones especiales de ejecución del contrato)"	"Condiciones_especiales_de_ejecucion_del_contrato/Nombre_de_la_condicion"	"string"
"Note (Criterio de Adjudicación del Lote)"	"Criterio_de_Adjudicacion_del_Lote/Nota"	"string"
"Note (Criterio de Adjudicación)"	"Criterio_de_Adjudicacion/Nota"	"string"
"Número de ofertas recibidas de pymes (Resultado del procedimiento)"	"Resultado_del_procedimiento/Numero_de_ofertas_recibidas_de_pymes"	"string"
"Número de recursos presentados (Información sobre el Contrato)"	"Informacion_sobre_el_Contrato/Numero_de_recursos_presentados"	"string"
"Ofertas recibidas de extranjeros comunitarios (UE) (Resultado del procedimiento)"	"Resultado_del_procedimiento/Ofertas_recibidas_de_extranjeros_comunitarios/UE"	"string"
"Ofertas recibidas de extranjeros no comunitarios (NO UE) (Resultado del procedimiento)"	"Resultado_del_procedimiento/Ofertas_recibidas_de_extranjeros_no_comunitariosi/NO_UE"	"string"
"País (Adjudicatario)"	"Adjudicatario/Pais"	"string"
"Ponderación (Criterio de Adjudicación del Lote)"	"Criterio_de_Adjudicacion_del_Lote/Ponderacion"	"string"
"Subtipo de criterio (Criterio de Adjudicación del Lote)"	"Criterio_de_Adjudicacion_del_Lote/Subtipo_de_criterio"	"string"
"Subtipo de criterio (Criterio de Adjudicación)"	"Criterio_de_Adjudicacion/Subtipo_de_criterio"	"string"
"Tipo de criterio (Criterio de Adjudicación del Lote)"	"Criterio_de_Adjudicacion_del_Lote/Tipo_de_criterio"	"string"
"Tipo de criterio (Criterio de Adjudicación)"	"Criterio_de_Adjudicacion/Tipo_de_criterio"	"string"
"Tipo de documento publicado (Otros documentos publicados)"	"Otros_documentos_publicados/Tipo_de_documento_publicado"	"string"
"Ubicación orgánica ID (2) (Entidad Adjudicadora Jerarquía)"	"Entidad_Adjudicadora_Jerarquia/Ubicacion_organica/ID"	"string"
"Ubicación orgánica ID (3) (Entidad Adjudicadora Jerarquía)"	"Entidad_Adjudicadora_Jerarquia/Ubicacion_organica/ID"	"string"
"Ubicación orgánica ID (4) (Entidad Adjudicadora Jerarquía)"	"Entidad_Adjudicadora_Jerarquia/Ubicacion_organica/ID"	"string"
"Ubicación orgánica ID (5) (Entidad Adjudicadora Jerarquía)"	"Entidad_Adjudicadora_Jerarquia/Ubicacion_organica/ID"	"string"
"Ubicación orgánica ID (6) (Entidad Adjudicadora Jerarquía)"	"Entidad_Adjudicadora_Jerarquia/Ubicacion_organica/ID"	"string"
"Ubicación orgánica ID (7) (Entidad Adjudicadora Jerarquía)"	"Entidad_Adjudicadora_Jerarquia/Ubicacion_organica/ID"	"string"
